Document,Topic_group
re video updates on the re video updates hi please add video width component map instead moment locations latin insert years video locations central insert final video locations central please within stream thanks,Hardware
help needed help needed hi please give rights table faces ctrl regards head please consider environment printing content communication classified confidential proprietary information content communication intended solely individual entity whom addressed others authorized receive intended recipient hereby notified disclosure copying taking action reliance contents information strictly prohibited unlawful received communication error please notify immediately by responding communication then delete integrity communication has maintained nor communication free viruses interceptions interference appreciate assistance preserving confidentiality correspondence thank,Access
access to bland induction on few things hi guys please provide review regards head analysis,HR Support
hardware internal re moving testing analysis starting hi considering please help completion attached form thank lead friday december pm moving testing analysis starting hello please note moving analysis discipline starting st please find attached his his please let required thank help head analysis architecture,HR Support
add user to com add user hi ask add thank,Access
organizational chart location on the re organizational chart location dear chart again link works link best,Hardware
add new pipes add pipes dear please add values listed pipe thanks december add pipes hello discussed let create add pipes pipes add filter amount filter method filter frequency processing create plan processing delete plan processing plan input plan output finish best regards tester,Internal Project
install outlook on phone install phone hi please advise how install phone had change both calendar thanks head,Purchase
teams teams hello please allow teams colleagues listed thank best,HR Support
deleting wrong epic deleting wrong epic hi usual process created epic tried link two stories later notified work process done stories issues epics please delete these issues needed going thank going create story follow approved model stories regards,Hardware
policies missing for policies hi friday results noticed he comparing write write missed policies please investigate he included policies assigned correctly him he needs resources regards,Storage
team pass access pass hello please rights pass best regards,HR Support
new de hi please add update pages attached content receive updated please within stream thanks,Miscellaneous
postpone windows forced upgrade re upgrade starting hello regarding friday upgrade possible upgrade after return holidays important deploy wednesday december available issues raised during after deploy until friday please upgrade until then please notify solution interfere daily work thank friday december pm upgrade starting hello please help upgrade upgrade followed path software center operating upgrade also upgrade automatically until did started after while received error probably because had sufficient drive under cleared drive automatically wanted upgrade manually nothing software center thank,Administrative rights
oracle time can not be submitted submitted dear sirs madames submitted days times within section inside enter possible submit working sometimes reaching site under sometimes screen standing hold enclosed please thank much kind regards senior consultant main main,HR Support
canada approvers add approvers to this canada approvers add approvers hello please add canada approvers thanks,Miscellaneous
cannot submit time card cannot submit card hello please rise call thank best regards engineer december cannot submit card hello please advise thanks administration officer december cannot submit card card si annual leave si card ca best regards tester omissions,HR Support
missing time cards for please action submit cards hello keep reeving about she left around months ago please deactivate these thank december please action submit cards dear receiving because cards haven submitted please note enough enter also make submit take corrective actions submitted card gets rejected breakdown submitted cards please submit accordingly possible country submitted cards card status entered entered total submitted cards submitted cards statuses explained error usually happens log calendar view period than days then delete which causes timecard switch error fix add back deleted delete entire timecard right hand side menu recreate again rejected card rejected by approvers please card entries accordingly resubmit entered status timecard few days entire timecard entered saved cards status has passed entered validation gone next submission step card issues resolve please wait corresponding resolutions,HR Support
access to leadership library wants library file opportunities lead accept decline requests,Storage
disable from ad re addresses please also add everybody decommissioned deleted once based answers thanks unit,Miscellaneous
addresses queries re addresses hi moreover please share rules around allowed addresses other addresses how these lists maintained date somebody leaving somebody joining envisage based questions facility teams myself allowed these groups anybody aiming these groups directed pending gets decommissioned deleted active directory thanks unit,Miscellaneous
new facing facing hello please add facing action needed due workstations replacement myself other details needed please thanks,HR Support
absence leave check approval flow absence leave hello requested cancel annual absence leave december special leave gained worked november st december think got cancel he approved today remaining leaves about thank,HR Support
urgent graduates program account extensions urgent re graduates program workstations graduates please approve extension more days until wednesday thanks senior tester december re graduates program workstations hello again also accounts seems expired please reactivate more days thanks senior tester december graduates program workstations hello program has extended by days off keep workstations more days thanks senior tester,HR Support
weekly renewal weekly renewal dear please advised guest has successfully changed quotes devices jersey jersey failed change none found devices under failed other errors were reported please great ahead,Miscellaneous
remove admin account re member hello install client back please touch requested by thank kind regards infrastructure friday december member si aces si removal rights upgrade la win se automat persons merci senior,Hardware
change name for external user friday december pm confluence thursday december pm confluence please rename stein he got divorced best regards ext extern confluence hi please create user her confluence thanks best regards ext extern des gent sitz main,Access
new starter tower starter dear please informed candidate accepted job offer become pm discipline officer st please create her credentials per attached form thank kind regards specialist,HR Support
new comer comer dear joined please him resources per attached also create confluence him thank,Access
new starter center re minute enrolment hello please find attached joining next thanks december minute enrolment hi please fill thank kind regards,HR Support
new starter tower starter dear please informed candidate accepted job offer become pm discipline cl please create her credentials per attached form thank kind regards specialist,HR Support
password not on android device android device dear please log assign removing re her her android phone updating after thanks kind regards engineer,Access
access card card dear colleagues please deactivate card let lost thank,Access
change approval daily reports change daily reports hello please assign sn daily basis changes approved by canadians under which changes logged canada canada hosting canada hosting canada hosting canada hosting canada si app canada app canada app canada app canada canada generic information canada hosting event monitoring canada please let question around topic thanks,Miscellaneous
files access link hi provide link thanks,Storage
add users to list bod testing add users testing hi guys please add testing thank regards senior tester colombia,Miscellaneous
term unpaid leave term unpaid leave dear let his term unpaid leave until thank lead,HR Support
wants to access practices wants practices accept decline requests,Storage
mailbox size increase mailbox size increase mailbox si la increase application engineer,Storage
to be approved approved getting escalated threshold triggering responsible setting december approved contract id director mob fixed zone,Miscellaneous
oracle project setup oracle setup hi please setup code per attached thanks,Internal Project
new purchase po purchase po dear purchased adaptor type hub please log allocation after receive item please take consideration mandatory receipts section order receive item ordered how video link please receipt number item needed processed thank kind regards administrator,Purchase
access to hello please give best regards senior developer,HR Support
new purchase po purchase po dear purchased professional ah patent lateral please log allocation after receive item please take consideration mandatory receipts section order receive item ordered how video link please receipt number item needed processed thank kind regards administrator,Purchase
approval flow flow hi indicate next expense flow indicates he recalls expense show his queue regards,Miscellaneous
addresses addresses please add members addresses everybody thanks unit,Miscellaneous
working from the site profile path changes working site profile path changes dear kindly note tuesday working site require assistance usual profile path changes change ones found other details provide please let thanks assistance best regards leader mobile,Miscellaneous
cables needed cables needed hello writing order cables arrived today order solved by thank best regards tester,Hardware
new client into network client hello writing order arrived client by please find addresses thank best regards tester,Access
authentication for authentication hello help setting received yesterday setup software needs issue want blind merge active directory credentials blind option works his credential worked fine haven apple infrastructure maybe needs part nj groups setup join macs nj devices appreciate help important big wish best loved ones during christmas good next kind regards engineer,Hardware
leaver card leaver nostrum parasite va ca si damaged,Access
access to the th floor floor hi please floor he joining thank officer,HR Support
all list dear va si head,Hardware
new purchase po purchase po dear purchased la type please log allocation after receive item please take consideration mandatory receipts section order receive item ordered how video link please receipt number item needed processed kind regards administrator,Purchase
new purchase po purchase po dear purchased adaptor premium hub please log allocation after receive item please take consideration mandatory receipts section order receive item ordered how video link kind regards administrator,Purchase
groups groups hi guys please update groups mentioned follows ones owners marked make ad has owner mentioned excel ones having text inactive marked red make disable groups seeing talking about groups recommend via script once done please preferably merge owners provide instructions how manage groups ownership thank,Miscellaneous
need assistance transferring files assistance transferring files hello kind help transfer files thank best senior tester,Storage
azure account mirroring request azure azure mirroring azure hi please log separate same azure mirroring azure regards leader dear please azure members assignment thanks kind regards,Access
internal transfer milos physical access belgrade transfer hardware allocation has assigned hello id card thank engineer tuesday december pm transfer hardware allocation has assigned hello please advised record number has assigned please review details take appropriate action reference number details description transfer dear please find form thank kind regards administrator location attachments transfer form please link kind regards please ref msg,HR Support
access network hello order connect machine thanks,Hardware
internal transfer form changes transfer form hello please fill transfer form thank administration officer,HR Support
software re software dear basically package license assigned assume buy parallels license handle installation joining kind regards engineer december software hi received software installed parallels virus copied out installation appropriate thanks,Access
laptop stand stand dear stand computer possible best regards tester,Hardware
job code job code hi anyone where job code database tables saw digging around find today job example spreadsheet job code chasing ideas schedule job rate date date tier rate regular tier rate thanks assistance continue digging find again consultant,Internal Project
new delivery hello received today black po invoice please advise please log receiving shipment kind regards engineer ext,Purchase
wants to access staffing assessment ms wants staffing assessment assessment accept decline requests,Storage
access to account for a project hi dear please log thanks friday december administrators hi today work possible allow user repositories related confluence looking forward regards by logo,Access
external drive drive dear borrow drive back format disks regards senior engineer,Storage
new purchase po purchase po dear purchased headset interface adapters pack compatible phones valid wide please log allocation after receive item please take consideration mandatory receipts section order receive item ordered how video link kind regards administrator,Purchase
wrong wrong hi please help delete items inserted deleted delete button other days thank br senior developer,HR Support
confluence access for a project resources resources hello starting work today repositories confluence resources thank looking forward regards,Access
maternity leave inventory update re maternity leave sorry administration officer,HR Support
oracle access hello noticed please whole thank officer ext blvd,HR Support
report link not secure reminder informed about campaign hi link attached error reports link regards director december reminder informed about campaign hello apologies awareness regardless confirmation eligibility yet automate logic reminder follow next four survey quarters july october currently preparing upcoming want make informed contribute campaign please engage report find out surveyed eligibility next weeks remember survey survey name segment type main offer filled other file dashboard more assigned pm similar receiving please amend records information inaccurate care update questions please care copyright rights reserved please refer section entities by old broad street,Hardware
notification issues between am to am time be resolved re repeatedly working days row interval till related hi second please out communication thank,Hardware
new starter form for it induction access card tuesday november pm re starter form induction hi everyone started form attached best regards head ext tuesday november starter form induction hi please assist completion attached return form empty part thank officer,HR Support
maternity leaver computer available computer available hi since december maternity leave computer working thanks pean developer,HR Support
replacement replacement dear please log assign replace thank kind regards engineer,Hardware
new purchase po purchase po has assigned hello kind log separate tickets assigning mobile devices employees thank engineer ext december purchase po has assigned hello please advised record number has assigned please review details take appropriate action reference number details requested location generic location summary purchase po additional comments requirements purchase po dear purchased galaxy link mobile please log allocation kind regards administrator assign reference assignment summary purchase po location generic location attachments image please link kind regards please ref msg,Purchase
list hi please these persons change name thanks officer,Miscellaneous
remove access space for re approved wrote hi please approve thank,HR Support
suspicious quote router suspicious quote router thursday december pm quote router arrivals hot sale routers promotional prices dear well family recently hot sale routers special promotion great price immediately share part price discount off unit price qty sec ax more items great price immediately enquiry more products visit router switch image removed by router switch image removed by image removed by image removed by image removed by router switch hongkong branch router switch image removed by image removed by image removed by twitter image removed by image removed by trouble viewing interested receiving,Hardware
apply restrictions to hi member needs added device disconnected disconnected disconnected also restrictions rights others thanks,Miscellaneous
maternity leave access card re maternity leave hello please find maternity form sorry delay seems forgot about thank administration officer,HR Support
new purchase po purchase po dear purchased please log allocation please log retrieve old device after receive item please take consideration mandatory receipts section order receive item ordered how video link kind regards administrator,Purchase
new purchase po purchase po dear purchased hard rubber slim lite glass lite please log allocation after receive item please take consideration mandatory receipts section order receive item ordered how video link please receipt number item needed processed kind regards administrator,Purchase
career for boca couch hi please help updates change couch myself thank discipline lead,Miscellaneous
change password information change information hi please help work thanks officer thursday december pm change information hi please help work thanks officer thursday december pm change information hi probably has requested unfortunately passwords site please site administrator application,Access
device alert notification paper at internal path device path printer details output copier details output saver mode scanner ready details panel off mode printing model name device name comment floor host name name print name file name printer name zone name name computer name share name device notified,Miscellaneous
access to dear please granting program enter program supported please favor colleague done him thank regards kind regards country,HR Support
manage access shared mailbox what it means make owner of the friday december re manage shared mailbox means hi also want make owner shared mailbox how note maybe thanks much december manage shared mailbox means dear please advised granted means shared mailbox kindly note take synchronization take thank kind regards analyst ext history reference history additional comments visible also please change mailbox owner thanks description shared mailbox manage shared mailbox shared mailbox name means owner shared mailbox users added shared mailbox users deleted shared mailbox ref msg,Storage
reset password re expire today va ca user pass evaluator back sector cod postal mobil fax,Access
wallpapers and lock screens wallpapers lock screens good morning please log cr raised provided lock screens wallpapers pushed user devices wallpapers also keep loop she stand during upcoming two weeks thank,Access
adding new columns to board board for project columns board board hi please rights myself board cannot add columns statuses thank discipline lead,Miscellaneous
addition report addition report hi please rise thank best regards engineer thursday december pm addition report la el thursday december pm addition report november pm addition report hello please find attached report addition cost found column report contains addition contain write best regards,Hardware
new purchase po purchase po dear purchased headsets cables cables please log allocation after receive item please take consideration mandatory receipts section order receive item ordered how video link please receipt number item needed processed thank kind regards administrator,Purchase
new purchase po purchase po dear purchased sculpt ergonomic mouse please log allocation after receive item please take consideration mandatory receipts section order receive item ordered how video link please receipt number item needed processed kind regards administrator,Purchase
cr re cr hi please production appreciate investigated matter priority additionally please extend configuration allowed well needs extend side please advise thanks tuesday november cr importance high hi please help extending add well proxy production inside secure proxy production production stack production inside secure production connecting cards appreciate resolution given production setup today thanks,HR Support
can read encrypted internal hi ask relevant outbox earlier today subject re configured tags properties checked encrypt contents attachments arrived presumably automatically decrypted him question content attachments were attachments particular actual content sensitive testing because about understand content left outbox easily find how content appears administrator interested results too kind regards information compliance officer extension,Storage
employee information query from modification information query modification hello product owner currently retrieving add compensation reviewer id currently query please help complete require corresponding compensation reviewer returned by query please let questions help complete thank lead,Miscellaneous
client access request client hi please create ticked based bellow assign pm la ca si client se care si pm hi pm user variables client tools pm call pm pm connected pm call has ended duration thank engineer,Hardware
pas for pollinate networks pollinate networks dear ask please client pre code per attached form both opp opportunity id thank,Internal Project
policies for db servers policies dear please thread assign myself thank technical leader re policies hi mentioned shared screens rules related file extension paths extensions example paths complete also number screen makes think related version each version has own installation path described link additionally categories processes bin bin details link help how choose software run running make sense create separate policy each version apply further related version build big policy versions separate times had change default installation path drive dedicated partition advise how these cases individual rules looking forward best regards technical leader re policies hi thank details seen rules related more analyze deeper unfortunately come back second part next best regards technical leader re policies hi amp capability exclusions selected assets currently policy controllers policy attached exclusions policy add let create policy regards mo december policies hi mo work amp policies please discuss add exceptions thanks regards wednesday december re policies hello pm replacement him thread replaced amp stage roll out touch side thank kind regards infrastructure tuesday december pm policies hi heard plan change software environment found recently special policy must catch understand status part environment treated dbms vendor recommends thank kind regards technical leader,Hardware
access request to project storage storage dear please users storage tester thank sincerely,Storage
access to bid vault bid vault hi please urgently provide location child folders working cannot uploaded by thanks,Storage
change owner of on one com re please dear owner please requests ownership thank,Miscellaneous
found old access card re updated lost card hi ladies recovered old card going bring upstairs thanks programme officer,Access
new starter belgrade belgrade hello please find enclosed two hires join thank kind regards administrator,HR Support
new starter former intern center starter testing dear please informed candidate internship program accepted job offer testing discipline december automation tester please change accounts credentials permanent status thank best regards specialist,HR Support
spike story bug issue types for project spike story issue types hello please help enable spike story issue types view planning thank,HR Support
credentials credentials hello please informed referenced has updated information client order avoid misunderstandings users created therefore required yet other information assistance require side please let thanks kind regards specialist thursday december pm credentials hi please resent users thanks head leeds please consider environment printing regarded confidential received error please notify destroy immediately statements intent shall become binding confirmed hard copy by signatory contents relate dealings other companies under control details which found,Access
account urgent request question urgent question hi plan infrastructure change members automatically via secured token please let export phone approx persons form appreciate prompt regards senior,Access
sn password urgent sn urgent hello please his sn quite urgent he needs approve urgent change thanks,Access
access to network for requested hello transferred bench december st he must these lists he also has changed thank assistance,HR Support
