Document,Topic_group
patch cord needed patch cord hi provide patch cable please changed seat seat cable best regards,Hardware
new delivery hello received today po led tv please advise please log receiving goods thanks technician,Purchase
non starter perform centre re update dear update supposed yesterday his starting date needs changed he won available next due personal reasons he stay touch about starting date moment erased his labor contract per bulgarian procedure please suspend his moment kind regards tuesday december pm importance high dear forms attached best regards,HR Support
visitor cards to be deactivated temporarily visitor cards va la ca va va visitor visitor visitor visitor visitor visitor visitor visitor visitor visitor visitor visitor,Access
reactivate access card va,Access
certificate expired for mantis support com re hi thanks did manage log regards pm re hi part by confirmed owner certificate renewed by relevant handling re certificate expired friday pm hi please identify owner let story required problem has form running regards,Hardware
new interns hardware allocation school of java en interns hardware allocation school hello please mote tickets assign queue individual allocations interns lost assets thank engineer ext,HR Support
installation installation hi think possible installed please creating process maps thank,Purchase
issue on issue hi please has running thanks analyst pl,Hardware
db backups for staging environment backups staging environment hello please log database backup core jobs databases wednesday please done rollback needed anyone by thanks best regards application engineer,Hardware
weekend access and for the event weekend event hello contacting regards event want host building ground floor february event organized by about event date february short description event called weekend event supports stage entrepreneurship estimated participants registering by bought event friday pm arrive pm setup saturday pm important mention entire event member present supervise activity requests entrance event done door communicates directly main street accordance schedule door event over close door by key secured contestants log during event please let requests possible offer event organizers final regarding requests additional information hesitate thank communication specialist,Hardware
speed re speed please log assign thank tuesday speed hello please physical negotiates sh status port name status duplex speed type connected trunk thank best regards engineer please consider environment print,Hardware
add to same hi regarding complain please pm same,Miscellaneous
please access to for please hello please enable user thank best regards senior developer,HR Support
new request hello backpack old has zip broken appreciate resolution take call shifts thank,Hardware
help on images help images hi dear please log he kind enough quickly help regards pm re hi sorry missed initial size double file properties help how guide he needs usual help due please help thanks pm re importance high hi must distribute cob today assist advise thanks mobility officer hi shortly previously requested images word document pasting unable view size please advise kind regards dear colleague denmark best joined position consultant based has years change experience started his strategy where he worked clients transform businesses he then joined mind gym where lead responsible selling designing multi change programmes likes years has running his own helping large simplify by killing unnecessary complexity working spends his supporting spurs improving average golf swing running odd marathon deciding which next thing delighted part appreciate help making him feel touch has approximately years experience total years work experience has degree has working accountant entering industry working he enjoys golf scuba diving good music delighted part appreciate help making him feel touch kind regards mobility officer,Hardware
printer th floor configuration printer floor hello please configuration printer floor assign proper please note printer turned connected details sub mask proceed close let further assist kind regards engineer ext re printer floor hi please move storage pm printer floor hello please advise old printer floor taken floor replaced public area please advise done old printer floor thank engineer ext printer floor hello please has installed therefore please redistribute old printer floor floor thank,HR Support
internal transfer transfer form hello please fill transfer form thank,HR Support
editing rights pas editing rights needed codes,Internal Project
sr stack issues notification sr stack issues hello please kind help out by by pm kindest regards leader tuesday re sr stack issues hi thanks how issues translate user impact thrown please ensure advise working rd party thank re sr stack issues hello issue experienced under reported users more less getting common did hear complaints lot users best regards engineer ext tuesday re sr stack issues hi guys issues meantime please again include thank sr stack issues yesterday senior engineer please consider environment print attach re sr stack issues hello kind reminder problem persist shall next logs stack link change switch stack stack port switch down stack link change switch stack stack port switch down redundancy standby lost standby processor fault peer present redundancy standby lost standby processor fault peer down redundancy standby lost standby processor fault peer redundancy change down session handle going down reason failure destroyed session destroyed neigh proc handle act dual neighbor down peer down notified chassis down event chassis gone down rf rf reload peer reload reason standby down redundancy peer lost active detected switch standby protocol interface port channel changed down link interface changed down link interface changed down link interface changed down link interface changed down link interface changed down link interface changed down link interface changed down link interface changed down link interface changed down link interface changed down link interface changed down link interface changed down link interface changed down link interface changed down link interface changed down link interface changed down link interface changed down link interface changed down link interface changed down link interface changed down link interface port channel changed down link interface changed down link interface changed down link interface changed down link interface changed down link interface changed down protocol interface changed down protocol interface changed down protocol interface changed down protocol interface changed down protocol interface changed down protocol interface changed down protocol interface changed down protocol interface changed down protocol interface changed down protocol interface changed down protocol interface changed down protocol interface changed down protocol interface changed down protocol interface changed down protocol interface changed down protocol interface changed down protocol interface changed down protocol interface changed down protocol interface changed down protocol interface changed down protocol interface changed down protocol interface changed down protocol interface changed down protocol interface changed down protocol interface changed down dual neighbor down expired channel channel event switch relay channel down destroyed session destroyed neigh proc handle act dual neighbor adjacency stack link change switch stack stack port switch stack link change switch stack stack port switch switch added switch stack switch has added stack switch added switch stack switch has added stack platform cable event switch stack cable removed channel channel event switch relay channel election elect active switch setting active switch relay elect switch port stack link change switch stack stack port switch down stack link change switch stack stack port switch down stack link change switch stack stack port switch stack link change switch stack stack port switch switch added switch stack switch has added stack switch added switch stack switch has added stack link interface changed link interface changed link interface changed link interface changed protocol interface changed link interface changed link interface changed protocol interface changed link interface changed protocol interface changed link interface changed protocol interface changed protocol interface changed protocol interface changed protocol interface changed platform pm inserted uplink module inserted switch slot protocol interface changed platform pm module inserted module inserted interface name platform pm module inserted module inserted interface name link interface changed link interface changed link interface changed link interface changed link interface changed link interface changed protocol interface changed protocol interface changed protocol interface changed protocol interface changed protocol interface changed link interface changed protocol interface changed link interface changed protocol interface changed link interface changed link interface changed link interface changed protocol interface changed link interface changed link interface changed link interface changed link interface changed protocol interface changed link interface changed protocol interface changed protocol interface changed protocol interface changed protocol interface changed protocol interface changed dual neighbor adjacency created session created neigh proc handle act protocol interface changed session handle going link interface port channel changed protocol interface changed protocol interface port channel changed dual neighbor down expired dual neighbor adjacency standby elected switch stack switch has elected standby redundancy peer active detected switch standby redundancy peer monitor event active detected standby insertion raw event peer found redundancy peer monitor event active detected standby insertion raw event peer redundancy change sync bulk succeed bulk sync succeeded rf rf terminal terminal reached senior engineer please consider environment print friday attach re sr stack issues hello changed cables issue resolved yet platform received chassis event become active channel channel event switch relay channel redundancy peer present redundancy peer down redundancy peer redundancy change platform became active ready switch primary after chassis confirmation election elect active switch setting active switch relay elect switch port platform received chassis event became active platform detail received chassis event became active switch primary count chassis down event chassis gone down logging host port started initiated logging host port started initiated console enable switch console type changed default link interface changed link interface changed protocol interface null changed link interface changed link interface changed down link interface changed down link interface changed down link interface changed down link interface changed down senior engineer please consider environment print tuesday attach sr stack issues hi doing well provide update anticipating valuable response note function program ensure timely response regards administrator work friday pm pm,Hardware
holiday leave normal va,HR Support
re request configuration on side urgent re has assigned hi please assign because add policy continue work kind regards senior infrastructure engineer infrastructure upcoming holiday none,Hardware
support mailing mailing hi guys please create mailing similar pm owners also added users add other guys available thank much,Miscellaneous
confluence user please confluence user please dear please create confluence user then give him permissions pages spaces thanks head public holiday march,Access
black duck users notification black duck users hi going upgrade application users ad hub version upgrade dear colleagues planning upgrade hub application version wednesday mean application accessible version user license agreement registration user license agreement appears hub must accept terms conditions hub fixed issue reported issue fixed release fixed issue whereby job runner container became disconnected running hub multi node docker swarm cluster also find more detailed information about updates mentioned please hesitate note wish notified planned works please accept invitation attached good how warm regards concerns please let best regards senior engineer,Administrative rights
oracle fusion services downtime notification re downtime hello approved thank pm downtime hi publisher monitoring loading database solution suggested restart reserved window operation pm reports module unavailable during specified period please notify about event attached find form please approve thank engineer,Hardware
machine should be accessed from port machine accessed port hello machine needs accessed other port purposes thank,Hardware
leaver re leaver thank please update status devices assigned token kind regards administrator,HR Support
database backup needed database backup needed hello backup database kindly assign permissions user create database backup instance accessed path backups backups find recent backup old plan periodically create backups database easier give copy latest backup kind regards senior developer blvd floor district,Access
question on share drive with team question share drive hi guys share drive folder share pictures taken trip folder write thanks regards,Storage
license expiration request for info re license expiration hello haven received past regarding replacement please issue best regards date friday license expiration hello everyone reported after receiving client installed locally machines license expired today currently deploying amp replacement meanwhile assets continue protected by difference download install updates device owner please follow instructions by past few days how install amp location require further information assistance please kind regards id image ext,Access
new starter colombia bogota bogota complete hi please help completed form joining march thank lead,HR Support
watch codes into pas watch codes greetings codes possible provide estimates please review let questions thanks watch virtual proof concept watch watch recognition phase products transportation id image,Internal Project
sent to com please add it to the blocked list please add hi received please take appropriate steps senior engineer,Miscellaneous
pas access good afternoon currently cannot codes forecast against currently view please enable questions please drop cheers change control presence mob,Internal Project
printer supplies printer supplies hello make order printer supplies printer floor color laserjet pro unfortunately supplier procedure talked she told she never made order she more information please help,Hardware
new purchase po hardware retrieval re purchase po hi mistake please correction purchased please log allocation please log retrieve old device after receive item please take consideration mandatory receipts section order make receipt item ordered how video link kind regards administrator,Purchase
access to joiner rights hi please help needed joiner per confluence spaces environments stag test test test test currently sitting infrastructure more secure due sensitive testers license taken care visual studio license studio taken care create user thank mobile,Access
address reservation fixed hello reserve machine fixed purposes months least thank,Hardware
new purchase po purchase po dear purchased monitor stands black please log allocation after receive item please take consideration mandatory receipts section order make receipt item ordered how video link kind regards administrator,Purchase
holiday query holiday query myself colleague querying database has changed automatically days holidays entitled days less holidays which equal attached screen accrual plan balance displays periodic accrual also unsure balance calculation date shown tried changing defaults back filling weekly sheet holidays automatically entered please regards presence central quay glasgow,HR Support
connection to oracle dear colleague help connect please followed instructions introduced says incorrect best regards,Hardware
defective display cable defective display cable hi had defective display cable provided today best regards developer distr,Hardware
snapshot snapshot dear please snapshot best regards engineer,HR Support
contract approve error write change hello please log best regards senior engineer pm re write change hello please give exact name contract link investigate issue related given change best regards senior engineer pm re write change hi thanks experiencing problem because change approve contract referral called cannot approve he approves taking next step suggestions thanks,Miscellaneous
please modify sub tasks for projects please modify sub tasks hello different sub tasks issue types remain sub tasks copy agile thank best regards senior developer,Internal Project
visual studio license key how receive visual studio license key hello got visual studio gave requires license key how obtain software future,Access
access usage usage dear please approve usage kind specialist,Miscellaneous
transfer from to as of transfer hi please fill transfer form thanks kind regards,HR Support
direct reports missing time re please action reports hi received has annual leave approved checked him status his leave has status complete please received action best regards wednesday pm please action reports dear part established processes each required submit his weekly basis each friday past must submitted receiving because reports haven followed process please help cascade accordingly gets possible breakdown reports please note refers has left maternity other absence leave please update person record otherwise please person directly submit country date total days,HR Support
migration migration dear please migration satisfaction application hi remember started migrating old stopped because were process how proceed migrate app completely kind regards engineer,Access
filter request filter hello please allocate change filter section locations recent shown thank,Miscellaneous
configuration conversation hi dear please log assign queue thanks engineer pm conversation pm task care pm pm pm done pm super merci pm,Hardware
mobile phone mobile phone hello kindly provide mobile phone setting also perhaps thanks head contracts,Hardware
space reservation rights for and reservation rights hello please reserve rooms floor thank,HR Support
second floor access approval second floor dear please provide second floor kind regards specialist,HR Support
access travel invoices po missing po hello kindly asking write po please let additional information required side kind regards leader ext st emergency number,Purchase
new purchase po purchase po dear purchased basic series please log allocation after receive item please take consideration mandatory receipts section order receive item ordered how video link please receipt number item needed processed kind regards administrator,Purchase
new pas name change for ops name change hi teams please name change regulatory change thank programme officer,Miscellaneous
license service now license hi dear please provide two licenses questions please let thanks,Access
new server hi please allow subcontractors thanks hi created users port logo engineer nab kiev ukraine,Access
access hi kindly ask give accounts payable thank,HR Support
new purchase po purchase po dear purchased lite has updated device under user name please log allocation after item please take consideration mandatory receipts section order receive item ordered how video link please receipt number item needed processed thank kind regards administrator,Purchase
new purchase po purchase po dear purchased keyboard please log allocation after receive item please take consideration mandatory receipts section order receive item ordered how video link please receipt number item needed processed kind regards administrator,Purchase
laptop expiration date expiration date hello question related expiration date name machine thanks,Hardware
new purchase po purchase po dear purchased please log allocation please log retrieve old device after receive item please take consideration mandatory receipts section order make receipt item ordered how video link kind regards administrator,Purchase
password reset hi guys please users back passwords thanks senior engineer hi passwords due expire next few days please passwords thank kind regards fax unit industrial centre cambridge please consider environment communication print views expressed individual except where specifically stated view subsidiaries addressed customers opinions advice contained subject relevant terms reserves right monitor communications networks notice intended solely named recipient contain privileged confidential information intended please notify immediately destroy must copy distribute take action reliance upon whilst efforts made safeguard cannot attachments virus free compatible accept liability respect viruses computer problems experienced important card details by,Access
denmark public holiday code oracle denmark public holiday code dear please thread public holiday code timecards created part denmark assist thanks pm re denmark public holiday code hi possible has she knows otherwise regards denmark public holiday code hi completed training whilst running unable find public holiday code denmark usually location nothing comes denmark advised back him kind regards,Internal Project
mailbox access mailbox hi please mailbox mailbox anymore thank,Storage
support com information hi please identify owner let story required problem has form running regards,Miscellaneous
please update the testing please update hello please make testing contains two thanks senior tester,HR Support
export to excel for delivery forecast export excel forecast hello please log best regards senior engineer pm care excel export pm pot pm share pm pm forecast dashboard view excel pm si view si ca pm copy paste ca lead skills status reason probability date duration si size search pm view si cod spate si pm si export si ca multi pm view va se view care va date pm pm update la etc view dashboard care ca ca pm inca date cod si la moment pot maine pm la face si date pm cat care cum excel export si pm la moment export demand pm,Hardware
to hi please include thank officer floor blvd district,HR Support
cont hello also please help thank,HR Support
request access to hello also please help regards,HR Support
opportunity code pas for tools opportunity code tools hi add known pipeline please help create opportunity code opportunity opportunity link also add unknown pipeline same client thanks kind regards programme portfolio officer,Internal Project
please provide access to tech radar please provide tech radar dear please help radar colleagues thanks senior test lead,HR Support
accounts accounts good morning please note changes deactivate user accounts create accounts users tester,Access
