Document,Topic_group
new purchase po purchase po dear purchased subscription subscription number updated include device under user name please log allocation after receive item please take consideration mandatory receipts section order receive item ordered how video link please receipt number item needed processed thank kind regards administrator,Purchase
new purchase po hardware allocation purchase po has assigned dear please separate hardware allocation regards engineer date wednesday pm purchase po has assigned hello please advised record number has assigned please review details take appropriate action reference number details requested location generic location summary purchase po additional comments requirements purchase po dear purchased received items xxx lite updated include device under user name link please add allocation device thanks after receive item please take consideration mandatory receipts section order receive item ordered how video link please receipt number item needed processed kind regards administrator assign reference assignment summary purchase po location generic location attachments image please link kind regards please ref msg,Purchase
license for everyone license everyone hi according please provide subscription thank best regards monitoring engineer thursday license everyone si la multi ca ca la fie ca professional azure senior engineer client,Access
new commission scheme to be created commission scheme created hi please create commission scheme named commission scheme thank,Internal Project
please turn on machine advised has turned off needs,Hardware
password change change hello please change expired she log her kind regards tester,Access
remove people from mailing mailing hello please metrics mailing groups thank senior tester,Miscellaneous
new purchase po purchase po dear purchased backpack base black please log allocation after receive item please take consideration mandatory receipts section order receive item ordered how video link kind regards administrator,Purchase
please access hr printer please printer dear please enable her printer too thanks vetting officer street center wednesday please importance high dear please enable location store human resources also please enable her shared mailbox thank,Storage
mapping the network re same has drive hi thanks help mapping drive currently also folders much also got hardware question please log has dropped few times think think going survive much travelling etc please order ask repair job screen falling off bottom looks falling apart thanks much,Hardware
leaver card re card leaver pride signature files image tower rom pride signature files image confidentiality notice content communication represents confidential proprietary information pride signature files image please consider environment printing wednesday card leaver hello la si,Access
access to new pas hello dear reports currently error saying administrator logging please let additional information require thank lead,HR Support
disable accounts integration disable accounts hello please rise caller best regards engineer wednesday pm re interface accounts turned off best regards wednesday pm re interface hello misunderstanding please turn back which disabled which disabled accounts entity disabled today by which supporting source accounts important synched other application having discussion identified outdated causing problems billing stage agreed kept off until corrected actions disable accounts asap export accounts corrections amend accounts received inform stakeholder turn accounts additional information please hesitate best regards engineer wednesday pm re interface hi disabled waiting issue fixed side best regards senior engineer wednesday pm re interface hi production environment causing undesirable updates customers please disable production environment until issue fixed thank kind regards engineer wednesday pm re interface hi take thanks interface charge interface under impression disabled please disabled asap has noticed updated causing him unnecessary work constantly needing updating thanks,Access
please action direct reports missing time please action reports hi received has term sick leave although he has officially returned work he his annual leave he work until mid fill out his until date annual leave looks public holidays missed please update his records code public holiday leave thanks much help cheers editorial consultant notice annual leave pm december pm december please action reports dear part established processes each required submit his weekly basis each friday past must submitted receiving because reports haven followed process please help cascade accordingly gets possible breakdown reports please note refers has left maternity other absence leave please update person record otherwise please person directly submit country date total days,HR Support
new purchase po re purchase po hi guys noticed ordered lite possible order phone phone se couple reasons firstly personal phone phone feel more comfortable similar secondly download mobile phone build show clients feel more slicker than android especially compared which extremely much more confidence application displayed apple device possible cheers purchase po dear purchased received items lite updated include device under user name link please add allocation device thanks please log retrieve old device after receive item please take consideration mandatory receipts section order receive item ordered how video link please make return old device back accessories left receive receipt number item needed processed receive old device take off user name kind regards administrator,Purchase
complete to fwd please action reports hi has left please complete his please director begin forwarded date please action reports dear part established processes each required submit his weekly basis each friday past must submitted receiving because reports haven followed process please help cascade accordingly gets possible breakdown reports please note refers has left maternity other absence leave please update person record otherwise please person directly submit country date total days,HR Support
assign en to hello please permanently assign thank regards,HR Support
oracle employee refund germany refund germany dear colleagues please help dear colleagues please create refund type germany well refund same accounts rest vat let options thank lead,Access
please dec and dec as annual leave for myself please annual leave myself dear sir madam kindly ask annual leave worked best regards,HR Support
eel administrator rights for eel administrator rights hi facility same level rights eel myself thank upcoming holidays holidays st blvd rd floor,HR Support
access to for hi please provide same level myself he facility thank upcoming holidays holidays st blvd rd floor,HR Support
oracle change finish date change finish date hi please help change date code tried change seems thanks officer,Miscellaneous
reject timecard dec timecard hi please help thanks best regards wednesday pm timecard hello dam reject la si ultima pot sheets reject ca member si pot ca la dam reject si la multi officer ext wednesday timecard cancel la la senior consultant mob zone please refer section entities,Hardware
access to folder folder hello please folder has approved copied convenience thanks best,Storage
new entity entity dear please entity denmark details entity salary allowance danish kroner copenhagen denmark code let thank,Internal Project
new purchase po purchase po dear purchased received items xxx lite updated include device under user name link please add allocation device thanks after receive item please take consideration mandatory receipts section order receive item ordered how video link please receipt number item needed processed kind regards administrator,Purchase
add leave on th december leave december hi please best regards analyst wednesday pm re leave december hello please investigate he has logged leave per attached print screen timecard december absence visible also print screen thank administration officer pm leave december se pare ca ca cum thanks senior tester,HR Support
new purchase po purchase po dear purchased deep cool please log allocation after receive item please take consideration mandatory receipts section order receive item ordered how video link please receipt number item needed processed thank kind regards administrator,Purchase
call ref new starter hardware allocation denmark password reset call ref starter hardware allocation denmark dear order thread his load his profile him rights mind contacting him informing him his give once thank kind regards engineer re call ref starter hardware allocation denmark hello everyone technical question how going profile order rights person needs log device which creates mobile which rights opposed where rights granted prior poses challenge unsure create ad synced rights rest setup macs usually much other than binding ad installing installed by user his ad credentials anyone advise please kind regards engineer re call ref starter hardware allocation denmark hi currently configuring kind regards mobility officer re call ref starter hardware allocation denmark hi unfortunately unable hand over until approved approvers possibility reject various reasons hi please keep hand over until settled kind regards administrator pm re call ref starter hardware allocation denmark importance high hi re well paternity leave until ensure gets asap common sense thanks loads date friday december re call ref starter hardware allocation denmark hi please opinion denmark without po thank kind regards administrator id image friday december pm re call ref starter hardware allocation denmark copenhagen denmark has confirmed advise kind regards mobility officer id image december re call ref starter hardware allocation denmark hi unfortunately wait till configured out via courier kind regards december re call ref starter hardware allocation denmark copenhagen asap which holiday he has approved please let today great difficult denmark by has everything installed package thanks wrote hi next kind regards administrator friday december pm re call ref starter hardware allocation denmark whose wrote good afternoon device has arrived until fully approved cannot proceed by allocating thank kind regards administrator tuesday december pm re call ref starter hardware allocation denmark please approve wrote hello please review provide po number supplier order completed thank kind regards administrator wednesday december pm re call ref starter hardware allocation denmark hello please review earliest convenience please wednesday december pm re call ref starter hardware allocation denmark hi placed order fastest even po has approved yet contacted supplier today about inform he let kind regards administrator wednesday december pm re call ref starter hardware allocation denmark hi has arrived understand he today tomorrow kind regards mobility officer november re call ref starter hardware allocation denmark hi told supplier make fastest option chosen thank kind regards administrator thursday november pm re call ref starter hardware allocation denmark thanks please ensure fastest option selected kind regards mobility officer november re call ref starter hardware allocation denmark good afternoon created submitted speed things supplier much gets please quires thank kind regards administrator wednesday november pm re call ref starter hardware allocation denmark thank please make information included wednesday november pm re call ref starter hardware allocation denmark part negotiation employ package he pro thanks wrote hello apologize missed went several times thread has justification challenged sufficient reason him wanted avoid lengthy topic which cause delays equipment wednesday november pm re call ref starter hardware allocation denmark done justification were want again wrote hello please help understand justification these exceptions instead pc pro instead please also indicate code cost device please make information incorporated ensure smooth progress wednesday november pm re call ref starter hardware allocation denmark hey yep book pro please he currently has requested thanks wrote thanks generally option selected relates developers digital option preference order accordingly regards mobile believes best him select plan handset reimburse him accordingly given few employees engaged by danish entity seems unlikely corporate plan cost effective kind regards mobility officer november re call ref starter hardware allocation denmark pro retina intel plus graphics kb please everything thanks wrote hi please specify which model needing pro retina intel plus graphics kb pro retina intel plus graphics kb apple core os please advised even order today days probably by december kind regards administrator wednesday november pm re call ref starter hardware allocation denmark importance high hi urgently starter december has fully approved by his his costs allocated he based copenhagen he danish keyboard assist thanks kind regards mobility officer november re call ref starter hardware allocation denmark hi definitely ordered once he then date kind regards november re call ref starter hardware allocation denmark hi said possible ready by then needs raised preferably idea re price supplier costs fall under he also noted must danish keyboard please ensure kept informed kind regards mobility officer november re call ref starter hardware allocation denmark good also hoping he he danish entity urgently him thanks mobility officer november re call ref starter hardware allocation denmark then again starter due till reminder kind regards november re call ref starter hardware allocation denmark hence query kind regards pm wrote hi highly doubt kind regards mobility officer id image november call ref starter hardware allocation denmark importance high hi well regards wanted double has raised required kind regards senior engineer mob id image zone,HR Support
internal transfer physical access transfer dear changes rd attaching transfer form thank kind regards administrator,HR Support
agile development agile hi has regards agile dear different industries begin embrace agile teams become more distributed clear agile way going change pleased inform colleagues about agile which scheduled take millennium march please find attached detailed agenda event unique event provide platform which discuss peers wide variety industries speaker panels comprise senior professionals agile experts several years experience renowned companies ibm more format event combination study presentations panel discussions networking coffee breaks encourage maximal interaction benefit bird discount order benefit discount please fill registration form attached agenda back via alternatively registration link link event parity events agile please touch directly additional information issues thank looking forward seeing regards corporate parity rd floor street westminster agile,Hardware
password reset re expire today change working work tried yesterday also thank senior tester wednesday pm expire today importance high dear expire today change pc press ctrl alt delete choose change thanks ext,Access
license required hi urgently require installed complete director please ask assist thanks mobility officer,Access
time and expenses spent against code spent against code hello how report out shows against code by thanks digital product strategy,Internal Project
password reset for external client expire today hi writing stakeholder client please advise matter he needs shared sources thanks mobile expire today expire today importance high dear expire today change pc press ctrl alt delete choose change thanks ext,Access
software licence software licence hi require licence software experienced issues built zip facility currently update package deployments tool investigating approach package modification until tool required regards build release,Administrative rights
extend active date extend active date hello please extend expired st december booking plane seats two colleagues asap she holiday travelling she kind regards design lead,HR Support
event triggered notifications event triggered hello please kind help out by assigning mentioned thank best regards leader december event triggered hi per raised assigned believe thanks dodo december pm re event triggered hello thank engineer phone december pm re event triggered hello certainly please even informational purposes assign please ask thank profile december pm event triggered hi finds well please advise solution provide event triggered describes level telephony daily log assigned certain skill example leader person has logged information telephony solution has enhancement looking forward thanks dodo december pm event triggered hello dodo follow chat topic please person help possible make daily analyst his her about how much late each report help well talking event triggered report rather than scheduled which even currently available ones because regardless person late indicating thank much best regards leader,Miscellaneous
budget vs budget vs va wednesday re budget vs ne si care care va thursday december budget vs minute ne cum si ne si actualize blvd floor district,Hardware
approval required ad admin account for orchestration from service now re required ad orchestration hi please create assign,Access
expense reports older than months expense reports older than months hi please let how view expense reports older than months option personalize search show expense reports thanks,Hardware
ticket request dear please create issue today upload profile picture authentication administrator told fill computer worked kind regards,Miscellaneous
oracle access to non journal report urgent please journal report urgent please hello please help ledgers report payable journal navigation thanks lead,HR Support
change of pm oracle and pas change pm dear please change code change take thanks,Miscellaneous
payroll element update oracle element update hello please call assign best regards engineer element update hello kindly asking assistance updating element individual compensation plans namely salary element configured particular aspect subject change think updated displayed salary change effective st december everything terms salaries modified want keep history confirming additional information required respect please let thank kind regards,Miscellaneous
oracle absence records absence records hi please assign best regards analyst wednesday pm absence records classification public hi question regarding accrual plan balance after adjustments absence cards pending other adjustment due part contract yearly periodic accrual carryover instead forfeiture mean please thanks lot consultant passive main germany die hat os die os die gen des bitte den die european commission has established european dispute resolution platform os platform under consumers os platform resolve disputes arising contracts providers established please refer information mandatory corporate particulars selected branches companies registered incorporated european contain confidential privileged information intended recipient received error please notify immediately delete unauthorized copying disclosure material strictly forbidden,Hardware
new purchase po purchase po dear purchased classic black please log allocation after receive item please take consideration mandatory receipts section order receive item ordered how video link please receipt number item needed processed kind regards administrator,Purchase
add me to integration project team add hello part required perform tasks noticed part requests incidents please add kind regards engineer mobile,Miscellaneous
cable monitor adapter hi please adapter monitor also ports dead somebody please prefer wired over finally currently keyboard switched keyboard version thanks build release,Hardware
add hours of bench time every day reminder submission hi please rise call thank best regards reminder submission si la multi ore bench row regards test consultant re reminder submission care se pare ca pot inca row ore bench respective regards test consultant december reminder submission timecards submission dear kindly remind fill submit timecards december especially containing absences overtime paid by wednesday rd making accuracy transmitted started working december assistance highly appreciated proceed extracting close absences overtime paid submitted after deadline picked next outstanding situations must made please let due please hesitate lead,Hardware
extend active date re extend active date please proceed extension asap thank galaxy date extend active date hello please extend expired st december booking plane seats two colleagues asap she holiday travelling she kind regards design lead,HR Support
access servers of hello help also timeout received even patch cord thank wednesday december re hello after granted application link working command respond timeout pinging bytes timed out timed out pinging bytes timed out timed out please help added comments also thank friday december pm dear please advised granted further assistance needed please let thank kind regards analyst ext history reference history additional comments visible update task task assignment assignee owner closed complete work notes description please help by ref msg,Hardware
december missing december hello issue cannot save entries period error cannot add absences type period despite logging errors paternal leave until help thank wednesday pm re december pare eventual la merci wednesday pm re december pot cannot add absences type ca help appreciated wednesday pm december hello please make december thanks officer,Hardware
new delivery hello received po sn deep cool black po sn please advise log kind regards engineer ext,Purchase
update update hello please add users joiners today thank engineer ext,Miscellaneous
reopen status reopen status hi guys please add reopen status possible ready testing possible reopen thank,HR Support
re we updated damaged access card new one re updated damaged card dear please assign card because other possession thank,Access
please action missing time please action hello please call assign please requester thank wednesday please action hi please kind tweak stops receiving reminders initially approach submit decision has revised record his thanks tuesday please action hi possible disable stop these reminders regards please action dear part established processes each required submit his weekly basis each friday past must submitted receiving because haven followed process please action possible breakdown please log accordingly training materials available id by each wednesday past period then also notified country date total days,HR Support
password expiring for external users re expiring users hi please help passwords users passwords expiring days thank october expiring users hello please advise passwords further assistance required please let thank best regards analyst ext hub,Access
monthly reports for to be sent to reports hello please make control control starting next thanks leader,HR Support
timecards december timecards december hi please timecards he left december december december code thank officer,HR Support
nae wants to access bucharest wants buzz please help accept decline requests,HR Support
change of admin for turners mail change dear please make thanks,Miscellaneous
configure address re import hello please review further assist thank best regards analyst wednesday pm import hi adjusted replaced by also removed well part thanks import la database ball import hello please advised ball import job has executed files type file ball import file found conforming balls file found please files wait about minutes files available job import thank automated,Hardware
access to boarding colleague dear colleague joining developer role please help requests granting her looks she storage please find related by link uploaded layouts accounts libraries configuration plan action default thank sincerely,Storage
access to storage dear colleague joining developer role please help requests granting her looks she storage please find related by link uploaded layouts accounts libraries configuration plan action default thank sincerely,Storage
low free space on partition low free partition dear running low disk lots free other partition please let done best regards senior tester,Hardware
please check addresses please addresses hello please addresses added thanks developer,Miscellaneous
access va number senior tester ext,HR Support
oracle job title change job title change dear seems wrong job title filled kindly help changing job title consultant lead cheers,Miscellaneous
confluence access to confluence and confluence hello please give repository confluence working thanks cr developer,Access
request internal transfer hardware allocation belgrade has been assigned to ms local support transfer hardware allocation has assigned hello more card thank engineer thursday december pm transfer hardware allocation has assigned hello please advised record number has assigned please review details take appropriate action reference number details description transfer dear change rd he must return his equipment he needs he also change thank kind regards administrator location attachments transfer form please link kind regards please ref msg,HR Support
access hi got assigned number please provide number delete his which stolen please perform change later than friday mid given needs work during weekend thanks,Hardware
request for laptop stand re stand hello kindly advised assist please log allocation thank kind regards administrator wednesday pm stand hello stand thanks efforts regards senior engineer,Hardware
